2023-09-08 14:09:25,2023-09-08 14:49:25,IP Address,187.212.208.199,100,2399,True,2023-09-08 14:49:30,R_21b7may8A1p29mG,,,,,20.6762,-103.3469,anonymous,EN,I agree,6.241,6.241,8.123,1,176,36.164,69.007,72.741,2,0,0,35.872,0,F_BQWTRNZTr6D3UjL,signature.png,5146,image/png,"I think would be easier if weight is shown in he horizontal axis instead of vertical and therefore height in vertical. ",17.105,45.398,110.743,2,0,0,1.785,0,55,40.702,40.702,43.757,1,,,,,,,,,,Helsinki,89.619,89.619,95.313,1,F_qL34EidFLZBjGiB,signature.png,5784,image/png,I divide the numbers of horizontal lines between the height of the bar(total cost) then quickly assume the proportion of the soda $ in order of the total cost in this case: 68$,11.377,40.57,136.74,12,False,70.347,70.347,71.792,1,F_zexSoCLHx4zzu2R,signature.png,5205,image/png,"Every step of the height stair cost 5 $, so just is a matter of size of the orange square assigned to vodka",6.001,42.816,122.133,17,True,25.602,46.045,47.367,2,F_7WFyF8uXnxKTT1v,signature.png,6428,image/png,Just seeing the percentage of the soda according to the height of the full spectrum ratios of foods in each Stockholm VS. N.Y,19.179,42.134,95.185,7,6,32.401,32.401,35.506,1,,,,,,,,,,,,,,,,,,,,,,,,,,,,,,,,,,,,,,,,,,,,,,,,,,,,,,,,,,,,,,,,,,,,,,,,,,,,,,,,44,23.055,23.055,25.584,1,,,,,,,,,,183,36.819,36.819,41.863,1,,,,,,,,,,74,44,29.583,34.583,37.472,3,,,,,,,,,,False,26.856,26.856,27.993,1,F_dbZNA1o0o2rL2Lv,signature.png,5069,image/png,Just using the XY logic,12.144,20.116,34.758,3,False,601.028,601.028,602.043,1,F_25XgppRnYgH8iEq,signature.png,9095,image/png,"I dont understand clearly the answer, but I think is a coherent relation between the data according to the real life empirical relation weight and height in people",8.789,122.083,153.515,6,183,18.702,18.702,24.554,1,,,,,,,,,,,,,,,,,,,,,,,,,,,,,,,,,,,,,,,,,,,,,,,,,,,,,,,,,,,,,,,,,,,,,,,,,,,,,,,,,,,,,,,,,,,,,,,,,,,,,,,,,,,,,,,,,,,,,,,,,,,,,,,,,,,,,,,,,,,,,,,,,,,,,,,,,,,,,,,,,,,,,,,,,,,,,,,,,,,,,,,,,,,,,,,,,,,,,,,,,,,,,,,,,,,,,,,,,,,,,,,,,,,,,,,,,,,,,,,,,,,,,,,,,,,,,,,,,,,,,,,,,,,,,,,,,,,,,,,,,,,,,,,,,,,,,,,,,,,,,,,,,,,,,,,,,,,,,,,,,,,,,,,,,,,,,,230,42.661,42.661,57.644,1,F_1fmenXXHCZKWhbv,signature.png,5129,image/png,"I did a percentage using the to bars, because it is not summatory in the logic that maybe the people of the 20-30 bar are included in the 30-40 bar",7.286,23.884,113.946,5,False,26.106,26.106,28.024,1,F_085caZmNF7PK1sl,signature.png,4265,image/png,"Just seeing the bar ",9.558,14.263,25.614,2,30 - 40 Km,57.774,57.774,59.967,1,,,,,,,,,,,,,,,,,,,,,,,,,,,,,,,,,,,,,,,,,,,,,,,,,,,,26,16.623,16.623,20.345,1,,,,,,,,,,Samsung,22.66,22.66,25.096,1,,,,,,,,,,,,,,,,,,,,,,,,,,,,,,,,,,,,,,,,,,,,,,,,,,,,,,,,,,,,,,,,,,,,,,,,,,,,,,,,,37,Man,"Corrected-to-normal vision (glasses, contacts, etc)",,"Music, Law",Beginner,"Bachelor’s degree (For example: BA, AB, BS)",,I am not colorblind,1.101,77.956,79.48,8,"I think just invert the XY axis of height and weight, height in vertical and weight in horizontal, would be more intuitive for the brain. :) Have a good day ",6158031479297ac1c777b5dc,False,False,False,False,False,True,False,True,False,True,False,True,False,False
2023-09-08 14:11:50,2023-09-08 14:50:10,IP Address,70.70.51.233,100,2300,True,2023-09-08 14:50:13,R_2vY85VrJ5kA63mo,,,,,49.1251,-122.6224,anonymous,EN,I agree,27.844,27.844,29.039,1,177,15.74,132.071,155.858,9,0,0,43.866,0,F_2azSUDr5ZAgDVzr,signature.png,5865,image/png,My thought process was to first locate the heaviest (y) individual and then verify their height (x). Not confusing.,15.928,41.644,103.997,7,0,0,4.384,0,24,46.819,46.819,50.682,1,F_1Ic9AXjp8VxyQxm,signature.png,4525,image/png,"The total cost is around $47. From that, 24 percent (just below the 25 line) seems to be associated with Sandwich. I did not find it confusing.",20.439,41.513,103.377,6,Stockholm,45.709,48.169,58.653,4,,,,,,,,,,False,48.896,48.896,50.222,1,F_p0lQucwYRUInS1z,signature.png,2949,image/png,The graph shows the total cost which a sum of all categories. We can imagine the graph per-category instead and look at the isolated cost. Toronto seems to have a bigger bar than Helsinki. I did not find it confusing.,10.158,62.532,171.211,10,False,213.869,213.869,319.391,1,F_3eaYov2d2wwDIPv,signature.png,3462,image/png,NYC is 1:1 while Stockholm seems to be around 3:1. A bit confusing to know which is bigger ratio wise,5.085,117.453,157.62,15,6,26.059,26.059,42.834,1,,,,,,,,,,,,,,,,,,,,,,,,,,,,,,,,,,,,,,,,,,,,,,,,,,,,,,,,,,,,,,,,,,,,,,,,,,,,,,,,,,,,,,,,,,,,,,,,,,,,,,,,,,,,,,,,,,,,,,,,,,,,,,,,,,,,,,,,,,,,,,,,,,,,,,,,,,,,,,,,,,,,,51,13.84,13.84,20.851,1,,,,,,,,,,Apr,18.241,19.628,21.682,2,,,,,,,,,,58,17,17.707,58.544,66.803,2,,,,,,,,,,Falling,46.453,55.025,65.254,2,,,,,,,,,,31,47.414,47.414,50.892,1,F_x4VgYoq7LVwaKB3,signature.png,5265,image/png,"Counted wrong. Should have been 26. Not confusing, got distracted.",7.663,147.088,197.58,10,,,,,,,,,,,,,,,,,,,,,,,,,,,,,,,,,,,,,,,,,,,,,,,,,,,,,,,,,,,,,,,,,,,,,,,,,,,,,,,,,,,,,,,,,,,,,,,,,,,,,,,,,,,,,,,,,,,,,,,,,,,,,,,,,,,,,,,,,,,,,,,,,,,,,,,,,,,,,,,,,,,,,,,,,,,,,,,,,,,,,,,,Nevada [NV],5.5,13.658,19.194,2,,,,,,,,,,4-6%,19.822,53.585,54.608,2,F_1pRa249Y1YajpX7,signature.png,4405,image/png,The color seems to match the color coding between 4-6 percent. I did not find it confusing.,11.224,23.823,49.95,2,,,,,,,,,,,,,,,,,,,,,,,,,,,,,,,,,,,,,,,,,,,,,,,,,,,,,,,,,,,,,,,,,,,,,,,,,,,,,,,,,,,,,,,,,,,,,,,,,,,,,,,,,,,,,,,,,,,,,,,,,,,,,,,,,,,,,,,,,,,,,,,,,,,,,,,,,,,29,3.753,15.814,23.813,2,,,,,,,,,,Great Britain,20.252,20.252,94.669,1,,,,,,,,,,Impossible to answer with this visualization.,36.853,127.869,132.241,5,F_3NwY7QLvtDLQSA0,signature.png,3260,image/png,No information regarding the absolute numbers. We can find the ratio but not the absolute numbers. I did not find it confusing.,3.311,96.204,102.65,2,,,,,,,,,,,,,,,,,,,,,,,,,,,,,,41,Man,Normal vision,,IT,Beginner,"Bachelor’s degree (For example: BA, AB, BS)",,I am not colorblind,1.003,61.757,62.576,11,No issues.,5ed7239e4aaed51a7d11e94e,False,False,False,True,False,False,True,False,False,True,True,False,False,False
2023-09-08 14:15:28,2023-09-08 14:50:32,IP Address,187.202.15.35,100,2103,True,2023-09-08 14:50:35,R_bBYquHiBklKfmAF,,,,,19.3946,-99.1178,anonymous,EN,I agree,50.873,50.873,51.862,1,176,15.404,30.742,35.669,6,0,0,41.247,0,F_1rrkd4Ako2XbfHa,signature.png,5454,image/png,I just looked for the highest weight and take the height out,12.22,170.038,191.496,7,0,0,53.709,0,,,,,,,,,,,,,,,,,,,,,,,,,,,,,,,,,,,,,,,,,,,,,,,,,,,,,,,,,,,,,,,,,,,,,,,,,,,,,,,,,,,,,,,,,,,,,,,,,,,,,,,,,,,,,,,,,,,,,,,,,,,,,,,,,,,,,,,,,,,,,,,,,,,,,,,,,,,,,,,,,,,,,,,,,,,,,,,,,,,,,,,,,,,,,,,,,,,,,,,,,,,,,,,,,,,,,,,,,,,,,,,,,,51,4.387,4.387,13.412,1,,,,,,,,,,Apr,3.91,5.652,6.78,2,,,,,,,,,,57,16,8.703,12.814,17.124,2,,,,,,,,,,I'm not sure,45.353,45.353,46.155,1,F_2EcoJlSgjIO5Keh,signature.png,3953,image/png,I think it was constant in the late months but had a severe decrease in price in the earlier ones,7.264,9.109,29.525,2,30,8.877,18.128,21.92,2,F_2ztLCDFdZQJfvw4,signature.png,6151,image/png,It increased 30 just by substracting 16 to 46,3.976,11.783,29.422,6,,,,,,,,,,,,,,,,,,,,,,,,,,,,,,,,,,,,,,,,,,,,,,,,,,,,,,,,,,,,,,,,,,,,,,,,,,,,,,,,,,,,,,,,,,,,,,,,,,,,,,,,,,,,,,,,,,,,,,,,,,,,,,0.83,1091.885,1091.885,1094.252,1,F_UoUKT6LB0phwGXv,signature.png,4517,image/png,Just located may between april and july,11.942,14.443,30.984,3,Aug 2019,,9.122,17.936,18.805,6,,,,,,,,,,0.88,0.68,63.725,70.864,73.479,2,,,,,,,,,,Falling,23.061,23.061,23.791,1,,,,,,,,,,Nevada [NV],3.758,13.061,14.75,2,,,,,,,,,,6-8%,86.016,86.901,89.13,2,,,,,,,,,,,,,,,,,,,,,,,,,,,,,,,,,,,,,,,,,,,,,,,,,,,,,,,,,,,,,,,,,,,,,,,,,,,,,,,,,,,,,,,,,,,,,,,,,,,,,,,,,,,,,,,,,,,,,,,,,,,,,,,,,,,,,,,,,,,,,,,,,,,,,,,,,,,,,,,,,,,,30,43.674,45.823,46.123,3,,,,,,,,,,Japan,13.901,13.901,14.894,1,F_1QhYqWk6ZdrZIYf,signature.png,5451,image/png,Great britain has more %than japan,2.47,47.216,50.43,12,Australia,2.923,14.486,18.695,5,F_uenCPkG5pY1HbdT,signature.png,4774,image/png,Just found the one with the most bronce medals,3.364,5.321,14.297,2,,,,,,,,,,,,,,,,,,,,,,,,,,,,,,23,Man,Normal vision,,Technologies and programming,Moderately knowledgeable,"Bachelor’s degree (For example: BA, AB, BS)",,I am not colorblind,0.741,32.353,33.338,8,,614b6e4a03ded5acfe2ef9b0,False,False,False,True,False,False,True,False,False,False,True,False,False,True
2023-09-08 14:13:00,2023-09-08 14:51:37,IP Address,105.12.0.5,100,2316,True,2023-09-08 14:51:42,R_3DwMwbbvKGck1j8,,,,,-26.3811,27.8376,anonymous,EN,I agree,11.881,12.913,14.098,2,176,2.915,102.261,108.859,6,27.138,27.138,30.779,1,F_2dnoeYUXRtqpR2B,signature.png,6049,image/png,"i just analyzed the chart and guided by the blue dots to reach to my final answer ",1.469,146.22,147.131,18,0,0,2.707,0,24,22.915,71.961,73.151,7,F_1luiIY8sJfHqtOh,signature.png,4241,image/png,just looked at the bar than came to my answer,0.88,95.718,107.641,16,Stockholm,12.681,47.045,48.501,7,,,,,,,,,,False,28.436,30.843,32.02,3,F_1g6gLZNXJezN6rY,signature.png,2951,image/png,well i dont know if i should add all other things or just a bar of only vodka,3.941,131.238,132.85,17,False,69.398,71.589,73.198,3,F_3GwcE4RI4qsBtyz,signature.png,3244,image/png,well just saw looked at the levels and compared them,10.716,113.889,114.915,17,41,9.386,39.309,41.881,5,F_1fe12jlZEL7GAYp,signature.png,2900,image/png,just looked at the bar than came to an answer,3.157,55.819,56.533,11,,,,,,,,,,,,,,,,,,,,,,,,,,,,,,,,,,,,,,,,,,,,,,,,,,,,,,,,,,,,,,,,,,,,,,,,,,,,,,,,,,,,,,,,,,,,,,,,,,,,,,,,,,,,,,,,,,,,,,,,,,,,,,,,,,,,,,,,,,,,,,,,,,,,,,,,,,,,51,6.473,20.08,21.226,4,,,,,,,,,,Apr,6.501,12.227,13.394,4,,,,,,,,,,58,47,5.275,60.024,62.896,13,F_3HUdYHjpF2tQtmL,signature.png,3502,image/png,"yeah got confused with whether the lower was for the whole year or quaterly ",7.451,85.333,124.487,7,Impossible to answer with this visualization.,25.995,31.993,33.604,3,F_3nGjP7NezlCFDGX,signature.png,5890,image/png,"i think i miss clicked ,the price was falling",7.809,157.888,159.907,13,36,7.812,109.314,110.416,12,F_57j9i7oFYWkV4YN,signature.png,4483,image/png,well i just did a quick addition than i came to that answer,4.991,51.512,54.994,8,,,,,,,,,,,,,,,,,,,,,,,,,,,,,,,,,,,,,,,,,,,,,,,,,,,,,,,,,,,,,,,,,,,,,,,,,,,,,,,,,,,,,,,,,,,,,,,,,,,,,,,,,,,,,,,,,,,,,,,,,,,,,,,,,,,,,,,,,,,,,,,,,,,,,,,,,,,,,,,,,,,,,,,,,,,,,,,,,,,,,,,,,,,,,,,,,,,,,,,,,,,,,,,,,,,,,,,,,,,,,,,,,,,,,,,,,,,,,,,,,,,,,,,,,,,,,,,,,,,,,,,,,,,,,,,,,,,,,,,,,,,,,,,,,,,,,,,,,,,,,,,,,,,,,,,,,,,,,,,,,,,,,,,,,,,,,,,,,,,,,,,,,,,,,,,,,,,,,,,,,,,,,,29,28.166,161.661,163.398,9,,,,,,,,,,Great Britain,13.425,29.7,31.004,5,,,,,,,,,,I'm not sure,22.501,85.626,88.399,4,F_1QMEHI7Oe78PudS,signature.png,4996,image/png,"i dont undertand  what do you mean buy absolute number ",3.192,63.364,64.229,7,99,12,38.173,138.251,144.058,6,,,,,,,,,,6,7.99,49.678,52.486,4,,,,,,,,,,30,Man,Normal vision,,graphic designer,Moderately knowledgeable,"Bachelor’s degree (For example: BA, AB, BS)",,I am not colorblind,1.301,65.104,66.507,16,need to be specific in other questions,60c3c8f790736ad8d329816b,False,True,False,False,False,False,True,False,False,True,True,False,False,False
2023-09-08 14:17:56,2023-09-08 14:51:50,IP Address,192.143.54.233,100,2033,True,2023-09-08 14:51:55,R_3G94sLKEDU4CAIr,,,,,-26.3811,27.8376,anonymous,EN,I agree,6.059,12.542,13.938,4,173,10.801,82.501,89.731,26,30.243,36.547,37.937,6,F_2qjuPv13iUYZLKV,signature.png,6036,image/png,The drawing was helpful and nothing was confusing at all.,12.881,91.902,153.373,33,0,0,3.101,0,,,,,,,,,,,,,,,,,,,,,,,,,,,,,,,,,,,,,,,,,,,,,,,,,,,,,,,,,,,,,,,,,,,,,,,,,,,,,,,,,,,,,,,,,,,,,,,,,,,,,,,,,,,,,,,,,,,,,,,,,,,,,,,,,,,,,,,,,,,,,,,,,,,,,,,,,,,,,,,,,,,,,,,,,,,,,,,,,,,,,,,,,,,,,,,,,,,,,,,,,,,,,,,,,,,,,,,,,,,,,,,,,,,,,,,,,,,,,,,,,,,,,,,,,,,,,,,,,,,,,,,,,,,,,,,,,,,,,,,,,,,,,,,,,,,,,,,,,451,152,12.065,82.635,86.833,15,,,,,,,,,,True,F_2VqDy05PMyyqzyl,signature.png,8176,image/png,I was trying to figure out if I should make the drawing circle like but the answer is visual enough and no confusing.,7.82,111.677,113.204,20,False,8.634,86.675,87.181,40,F_1ifyS6IRNX7QaDD,signature.png,4764,image/png,To make my answer visual and the drawing was helpful,3.852,111.86,113.002,20,False,9.294,71.696,73.163,22,F_vDANIIvTuGQOqYx,signature.png,5607,image/png,"The drawing again made it easier to show how I got to the answer, no nothing confusing.",20.822,47.186,85.49,20,N.Y.C.,6.715,23.275,25.474,10,F_2q300cBP1o8pbsX,signature.png,5544,image/png,trying to make the line more straight and drawing the lines to my answers and it was not confusing.,4.785,53.739,118.538,19,0.71,3.908,27.566,31.13,11,,,,,,,,,,Jan 2020,,7.125,35.41,37.262,14,F_23TE4V3rNHA8Mzt,signature.png,6111,image/png,Making sure the answer is clear and the drawing was helpful.,8.083,30.505,57.252,19,0.89,0.73,8.544,107.609,109.002,40,F_RtwX8r4otPwEqit,signature.png,8023,image/png,Making the lines straight and make sure the answer is pointed out. The drawing helped.,4.423,133.605,135.296,50,Rising,6.035,46.757,48.502,19,,,,,,,,,,,,,,,,,,,,,,,,,,,,,,,,,,,,,,,,,,,,,,,,,,,,,,,,,,,,,,,,,,,,,,,,,,,,,,,,,,,,,,,,,,,,,,,,,,,,,,,,,,,,,,,,,,,,,,,,,,,,,,,,,,,,,,,,,,,,,,,,,,,,,,,,,,,,,,,,,,,,,,,,,,,,,,,,,,,,Google,5.268,34.193,35.94,16,,,,,,,,,,False,8.912,38.02,39,29,F_3OfxEgYqHVKVhWz,signature.png,9603,image/png,Was trying to make a spot the difference drawing to make my answer clear and the drawing helped.,8.488,49.98,93.503,26,Retail,3.044,12.414,14.049,12,,,,,,,,,,80,4.119,36.268,37.303,10,F_ei0exsex2CAtyql,signature.png,7417,image/png,To make my answer clear enough to be seen and drawing helped.,2.737,50.937,52.198,19,Samsung,6.825,12.727,14.138,10,,,,,,,,,,,,,,,,,,,,,,,,,,,,,,,,,,,,,,,,,,,,,,,,,,,,,,,,,,,,,,,,,,,,,,,,,,,,,,,,,33,Women,Normal vision,,Client Services,Moderately knowledgeable,High school graduate - High school diploma or equivalent (for example: GED),,I am not colorblind,2.227,67.211,68.334,67,No issues were experienced and the survey was very detailed and clear enough to understand and the pictures and drawing was helpful and fun.,615f04836985bb3ce5815f3c,True,False,True,False,False,False,False,True,False,False,False,False,True,False
2023-09-08 14:17:27,2023-09-08 14:52:30,IP Address,41.216.203.31,100,2103,True,2023-09-08 14:52:36,R_3D8wKq4NHSwZu4i,,,,,-33.91,18.4304,anonymous,EN,I agree,104.283,104.283,106.022,1,177,82.172,82.172,89.343,1,15.202,25.05,26.362,11,F_cY1nnMOyhURZdjb,signature.png,6353,image/png,"I looked at the scale indicators to find who was heaviest, and then managed to decipher what their height seemed to be. It was not complicated.",10.928,115.228,118.724,46,0,0,3.32,0,,,,,,,,,,,,,,,,,,,,,,,,,,,,,,,,,,,,,,,,,,,,,,,,,,,,,,,,,,,,,,,,,,,,,,,6500,9.743,32.094,35.475,4,F_1N209qQqoWBZHsr,signature.png,4023,image/png,The data meets at the point measuring 6500 girls.,6.454,25.939,51.848,8,True,14.37,22.573,23.681,4,F_2y8k5pLAw1a2QW0,signature.png,7928,image/png,"I compared the amounts and each year, Isla surpassed Amelia.",6.116,132.507,133.708,23,2012,15.525,32.022,33.383,7,,,,,,,,,,Rising,17.061,19.872,21.378,3,F_12AxqwhEUPFkWIb,signature.png,5287,image/png,I  looked at the upward trend.,7.821,80.075,97.005,21,False,12.915,21.98,23.353,4,F_ensQuH2cLaUD8HL,signature.png,8176,image/png,There is a clear downward trend in the name between the years.,4.694,47.151,73.306,13,44,10.107,29.947,32.501,3,,,,,,,,,,182,7.322,21.27,26.694,3,,,,,,,,,,74,44,5.801,43.978,47.198,6,,,,,,,,,,False,19.83,47.03,48.049,5,F_3RbjjXlG3IX5Zbr,signature.png,5305,image/png,"I found the center point of the data on the graph, and there are no dots to indicate that the data is true.",10.557,72.836,77.398,12,Impossible to answer with this visualization.,20.701,43.849,45.145,5,F_3lMK5vBWpE7Y2xj,signature.png,8349,image/png,"How tall one is, is not necessarily going to impact how heavy they are. Similarly, how short someone is, does not necessitate that they'll be light. The tallest person happens to be one of the lightest in weight, and the heaviest happens to be the second tallest.",11.912,269.971,280.493,28,161,17.356,57.556,59.124,6,F_3PZ6JWQ7dc8RT7y,signature.png,3640,image/png,"This person stands out the most, as they are the only individual with these stats. It is the shortest and lightest person.",4.304,25.796,66.653,8,,,,,,,,,,,,,,,,,,,,,,,,,,,,,,,,,,,,,,,,,,,,,,,,,,,,,,,,,,,,,,,,,,,,,,,,,,,,,,,,,,,,,,,,,,,,,,,,,,,,,,,,,,,,,,,,,,,,,,,,,,,,,,,,,,,,,,,,,,,,,,,,,,,,,,,,,,,,,,,,,,,,,,,,,,,,,,,,,,,,,,,,,,,,,,,,,,,,,,,,,,,,,,,,,,,,,,,,,,,,,,,,,,,,,,,,,,,,,,,,,,,,,,,,,,,,,,,,,,,,,,,,,,,,,,,,,,,,,,,,,,,635,7.16,117.788,121.589,7,F_3D6igoRE7Wwomhe,signature.png,4221,image/png,I added all of the values between 20 and 40 kms,5.038,22.942,41.026,5,False,10.689,14.014,15.118,3,F_3ZR14q64RdJFaxP,signature.png,4078,image/png,"According to the graph, the comparison shows that 30 to 40 km is most popular.",8.323,24.849,54.287,8,30 - 40 Km,21.975,28.384,30.213,4,,,,,,,,,,,,,,,,,,,,,,,,,,,,,,,,,,,,,,,,,,,,,,,,,,,,Google,16.223,20.35,21.91,3,,,,,,,,,,False,27.429,30.705,32.052,3,F_2PzNWAfBys1p6Um,signature.png,7056,image/png,The diagram representing Yahoo is bigger than Amazon.,12.626,51.868,53.149,6,Retail,8.536,11.353,14.313,3,,,,,,,,,,,,,,,,,,,,,,,,,,,,,,,,,,,,,,,,,,,,,,,,,,,,,,,,,,,,,,,,,,,,,,,,,,,,,,,,,,,,,,,,,,,,,,,,,,,,,,,,,,,,,32,Women,Normal vision,,Psychology,Moderately knowledgeable,"Bachelor’s degree (For example: BA, AB, BS)",,I am not colorblind,3.267,50.579,52.068,41,No challenges experienced. I would have liked to access a toolkit to draw straight lines with etc.,5f45772f6c74b91760652841,False,False,False,False,True,False,False,False,True,False,False,True,True,False
2023-09-08 14:15:13,2023-09-08 14:53:30,IP Address,102.36.91.160,100,2297,True,2023-09-08 14:53:36,R_2ARVdxy7i72DYgW,,,,,-26.3811,27.8376,anonymous,EN,I agree,22.217,24.212,25.62,2,177,3.229,323.058,331.367,4,20.491,20.491,22.035,1,F_2PsO1THXATmOk5s,signature.png,6707,image/png,The labels on the side helped with identifying which is height and weight and I simply connected the dots,94.909,170.794,172.01,7,0,0,4.775,0,60,24.255,68.745,70.056,5,F_2VILMtNJbh8a2Zd,signature.png,3219,image/png,The blue represents the sandwich costs,5.985,64.043,67.246,8,Stockholm,27.101,42.967,45.696,5,,,,,,,,,,True,14.725,17.157,18.564,3,F_2WSHh13tcPiFbnq,signature.png,4484,image/png,"Nothing confusing, I can clearly understand, I looked at the length of each section for vodka",8.557,54.943,58.492,7,False,32.138,72.043,73.199,4,F_RE2qFIYHd9mHbMd,signature.png,6038,image/png,The ratio in NYC is slightly the same and for Stockholm its higher,2.913,89.74,92.298,13,49,21.605,49.834,52.874,3,F_3nAYCAvfbIBCoXk,signature.png,5118,image/png,"The graph is confusing, in the sense that I am not sure if the cost start where the section for peanuts starts or ends. ",6.001,49.774,103.482,7,,,,,,,,,,,,,,,,,,,,,,,,,,,,,,,,,,,,,,,,,,,,,,,,,,,,,,,,,,,,,,,,,,,,,,,44,146.61,163.391,164.609,4,,,,,,,,,,182,22.31,35.507,40.353,3,,,,,,,,,,182,161,30.31,38.319,41.384,5,F_3pf42MHznugjJwh,signature.png,5863,image/png,The dots are visible and show the range in height clearly,4.89,28.748,64.061,8,False,8.257,38.062,39.503,6,F_3iUrKGMIuLHa1uR,signature.png,5726,image/png,"The section does not represent a group of individuals, that's why I say it's false",7.7,65.018,68.175,9,Impossible to answer with this visualization.,13.81,15.058,16.233,2,F_3MAuoQJWp90746q,signature.png,3386,image/png,I'm not sure that we can be able to identify negative linear relationship in the chart.,8.196,127.461,151.379,15,182,23.669,35.986,37.384,4,,,,,,,,,,,,,,,,,,,,,,,,,,,,,,,,,,,,,,,,,,,,,,,,,,,,,,,,,,,,,,,,,,,,,,,,,,,,,,,,,,,,,,,,,,,,,,,,,,,,,,,,,,,,,,,,,,,,,,,,,,,,,,,,,,,,,,,,,,,,,,,,,,,,,,,,,,,,,,,,,,,,,,,,,,,,,,,,,,,,,,,,,,,,,,,,,,,,,,,,,,,,,,,,,,,,,,,,,,,,,,,,,,,,,,,,,,,,,,,,,,,,,,,,,,,,,,,,,,,,,,,,,,,,,,,,,,,,,,,,,,,,,,,,,,,,,,,,,,,,,,,,,,,,,,,,,,,,,,,,,,,,,,,,,,,,,,461,16.169,67.97,68.941,4,,,,,,,,,,False,12.159,44.574,46.16,4,F_2046Lz1JnBAPAYx,signature.png,8625,image/png,"Nothing confusing here either, the graph is pretty clear",3.137,65.364,66.724,13,30 - 40 Km,53.616,57.433,59.091,3,,,,,,,,,,,,,,,,,,,,,,,,,,,,,,,,,,,,,,,,,,,,,,,,,,,,,,,,,,,,,,,,,,,,,,,,,,,,,,,,,,,,,,,,,,,,,,,,,,,,,,,,,,,,,,,,,,,,,,,,,,100,10,19.258,36.859,38.05,5,F_3ptNvDWa1plKo5h,signature.png,7411,image/png,"The only thing confusing is the question, my interpretation is that the range of the chart is 10 to 100",4.149,14.523,53.923,6,6,23.293,41.649,43.673,3,,,,,,,,,,32,Women,"Corrected-to-normal vision (glasses, contacts, etc)",,Legal,Beginner,"Professional school Degree (For example: MD,DDS,DVM,LLB,JD)",,I am not colorblind,1.557,39.791,40.973,12,"There were no problems, thank you for the study. ",60decd2097f9a85cd3a908b0,False,True,False,False,False,True,False,False,False,True,False,True,False,False
2023-09-08 14:14:16,2023-09-08 14:54:10,IP Address,176.63.15.109,100,2393,True,2023-09-08 14:54:14,R_2BgNvVo1U4htyBO,,,,,47.5636,19.0947,anonymous,EN,I agree,17.841,17.841,18.705,1,177,24.489,82.436,99.581,5,0,0,21.903,0,F_7X8LryF38MEJUoV,signature.png,6507,image/png,Firstly I found the tallest person and I used this person's blue dot to calculate the height (so the dot was useful). I thought that it was closer to the middle but not exactly at the middle and that it is probably not 176 because it's farther than that. It was hard to predict the exact number because there weren't any scales or lines that could indicate the exact numbers.,19.352,551.487,553.361,63,0,0,1.908,0,,,,,,,,,,,,,,,,,,,,,,,,,,,,,,,,,,,,,,,,,,,,,,,,,,,,,,,,,,,,,,,,,,,,,,,,,,,,,,,,,,,,,,,,,,,,,,,,,,,,,,,,,,,,,,,,,,,,,,,,,,,,,,,,,,,,,,,,,,,,,44,12.709,12.709,18.275,1,,,,,,,,,,183,36.248,46.101,46.887,3,,,,,,,,,,74,44,6.497,26.569,30.37,8,,,,,,,,,,False,42.653,42.653,43.904,1,F_21hMwCa0yIhdAnU,signature.png,5642,image/png,"I found the exact location where weren't any dots. The 176 was not on the scale, so it was hard to measure the right spot.",17.8,106.323,114.283,24,True,14.217,49.676,51.176,6,F_3KuW1KDvDMWTmhh,signature.png,3210,image/png,There is similar weight between the person who has the most low weight and the person who is the second tallest. Furthermore every person between them has a similar partner.,8.885,154.535,178.535,9,176,17.94,65.801,68.577,8,F_1BRH0o5nlfP6hTb,signature.png,4995,image/png,"I found the most prominent outlier and the I measured the height of it. ",7.158,80.446,83.801,15,29,9.679,9.679,20.871,1,F_cuvkXqt7XWCR86R,signature.png,5173,image/png,I am really sorry I messed this up. But now I know that the right answer is probably 51. Firstly I found the month and than the blue dot which was above of it. The scale was also helpful to find the answer which is the closest to the real one..,42.302,332.849,361.351,39,Apr,9.945,19.978,49.447,5,,,,,,,,,,57,16,40.502,57.907,60.964,2,,,,,,,,,,Falling,63.983,63.983,71.266,1,,,,,,,,,,27,22.157,22.157,63.111,1,,,,,,,,,,,,,,,,,,,,,,,,,,,,,,,,,,,,,,,,,,,,,,,,,,,,,,,,,,,,,,,,,,,,,,,,,,,,,,,,,,,,,,,,,,,,,,,,,,,,,,,,,,,,,,,,,,,,,,,,,,,,,,,,,,,,,,,,,,,,,,,,,,,,,,,,,,,,,,,,,,,,,,,,,,,,,,,,,,,,,,,,,,,,,,,,,,,,,,,,,,,,,,,,,,,,,,,,,,,,,461,68.022,68.022,70.947,1,,,,,,,,,,False,24.157,26.94,30.778,2,F_1gN5BYeytuZX5eG,signature.png,3493,image/png,The height of the blue line between 40 and 50 is taller.,5.786,55.345,61.194,7,30 - 40 Km,20.168,38.301,40.049,5,,,,,,,,,,,,,,,,,,,,,,,,,,,,,,,,,,,,,,,,,,,,,,,,,,,,Google,12.328,15.602,18.504,2,,,,,,,,,,False,22.051,22.051,26.233,1,F_PTIovbTfiY0qezv,signature.png,4209,image/png,The space at Yahoo is twice as much as at Amazon.,9.203,64.647,67.985,7,Retail,7.262,9.159,10.833,2,,,,,,,,,,,,,,,,,,,,,,,,,,,,,,,,,,,,,,,,,,,,,,,,,,,,,,,,,,,,,,,,,,,,,,,,,,,,,,,,,,,,,,,,,,,,,,,,,,,,,,,,,,,,,22,Women,Normal vision,,Education,Beginner,Some college but no degree,,I am not colorblind,1.119,38.667,39.205,9,Overall it was great.,6107aa76ee9845023fb0cb80,False,False,False,False,True,False,True,False,False,False,False,True,True,False
