2023-09-08 14:13:34,2023-09-08 14:29:44,IP Address,176.63.28.244,100,969,True,2023-09-08 14:29:48,R_2E7bKzEVRvQoxPT,,,,,47.2019,18.1376,anonymous,EN,I agree,11.784,13.205,14.405,2,176,26.474,26.474,31.867,1,0,0,7.777,0,F_1BRa7VazKfJpQg0,signature.png,6869,image/png,nothing was confusing,8.606,60.693,68.82,9,0,0,2.039,0,,,,,,,,,,,,,,,,,,,,,,,,,,,,,,,,,,,,,,,,,,,,,,,,,,,,,,,,,,,,,,,,,,,,,,,6500,19.335,19.335,22.884,1,F_OcWnOOwT1z2YO4x,signature.png,3859,image/png,the colors were helpful,9.445,35.033,35.523,5,True,22.774,22.774,24.974,1,F_2Ensl14S9yjq5rR,signature.png,8565,image/png,the purple was always above the orange field,27.527,83.497,84.089,5,2012,22.637,23.866,27.014,2,,,,,,,,,,Rising,15.815,15.815,18.09,1,F_8BUjIzmGYJulwCR,signature.png,5145,image/png,"the top of the green field  was going up ",5.454,73.822,74.249,6,False,18.373,18.373,21.095,1,F_2AXtgCdxMhMO9PD,signature.png,8816,image/png,the colors were helpful.,18.404,48.726,63.996,8,,,,,,,,,,,,,,,,,,,,,,,,,,,,,,,,,,,,,,,,,,,,,,,,,,,,,,,,,,,,,,,,,,,,,,,,,,,,,,,,,,,,,,,,,,,,,,,,,,,,,,,,,,,,,,,,,,,,,,,,,,,,,,,,,,,,,,,,,,,,,,,,,,,,,,,,,,,,,,,,,,,,,,,,,,,,,,,,,,,,,,,,,,,,,,,,,,,,,,,,,,,,,,,,,,,,,,,,,,,,,,,,0.71,23.753,23.753,27.931,1,,,,,,,,,,Nov 2019,,11.652,16.146,17.451,3,,,,,,,,,,0.89,0.68,40.432,44.019,48.194,2,,,,,,,,,,Constant,27.459,27.459,29.256,1,F_21sPy48cP0H8sFp,signature.png,3052,image/png,"after every downfall there was a rising month ",8.254,53.436,57.693,5,,,,,,,,,,,,,,,,,,,,,,,,,,,,,,,,,,,,,,,,,,,,,,,,,,,,,,,,,,,Nevada [NV],4.405,17.448,21.593,7,,,,,,,,,,6-8%,15.715,18.055,18.701,3,,,,,,,,,,460,27.437,27.437,33.989,1,,,,,,,,,,True,23.223,23.223,24.883,1,F_1jjnO6OQcbj3rQs,signature.png,3621,image/png,"the numbers confused me, therefore i messed up my answer and later realized that its the same ",28.381,79.306,81.205,4,30 - 40 Km,5.984,15.414,16.578,4,,,,,,,,,,,,,,,,,,,,,,,,,,,,,,,,,,,,,,,,,,,,,,,,,,,,,,,,,,,,,,,,,,,,,,,,,,,,,,,,,,,,,,,,,,,,,,,,,,,,,,,,,,,,,,,,,,,,,,,,,,,,,,,,,,,,,,,,,,,,,,,,,,,,,,,,,,,,,,,,,,,,,,,,,,,,,,,,,,,,,,,,,,,,,,,,,20,Women,Normal vision,,psychology,Relatively Skilled,High school graduate - High school diploma or equivalent (for example: GED),,I am not colorblind,1.183,54.459,56.2,8,,61489f86e02baa417fcc98b2,True,False,False,True,True,False,False,False,True,False,False,False,False,False
2023-09-08 14:14:42,2023-09-08 14:29:58,IP Address,93.34.149.154,100,915,True,2023-09-08 14:30:00,R_1Nejz2jhtWZgg7D,,,,,45.0914,7.6639,anonymous,EN,I agree,34.504,34.504,36.59,1,74,284.465,284.867,293.878,2,0,0,12.925,0,F_XMUAaptrmICW3CN,signature.png,5776,image/png,I first went to see which one was the heaviest one and then followed that line to see his height,12.144,44.934,77.44,7,0,0,1.237,0,,,,,,,,,,,,,,,,,,,,,,,,,,,,,,,,,,,,,,,,,,,,,,,,,,,,,,,,,,,,,,,,,,,,,,,,,,,,,,,,,,,,,,,,,,,,,,,,,,,,,,,,,,,,,,,,,,,,,,,,,,,,,,,,,,,,,,,,,,,,,44,14.997,14.997,16.873,1,,,,,,,,,,183,10.6,10.6,13.688,1,,,,,,,,,,74,44,11.991,18.849,24.211,2,,,,,,,,,,False,18.737,18.737,20.512,1,F_9tYxceLaL0DZsjL,signature.png,5246,image/png,I first had a glance of the one that were with 176 cm and then tried to find results with 55 kg,21.238,31.505,60.515,3,I'm not sure,10.113,10.113,10.975,1,F_9Mrr00lJgDUPNWF,signature.png,7345,image/png,"I'm not sure of the answer, since if providing the height of the individuals I should compare the weight, then it is actually a negative one, but I was not sure of the question",31.049,32.383,75.822,2,182,14.913,25.914,29.735,4,,,,,,,,,,51,6.403,6.403,9.225,1,,,,,,,,,,Apr,7.702,8.928,9.992,2,,,,,,,,,,58,16,32.57,40.285,44.09,2,,,,,,,,,,Falling,16.666,16.666,17.939,1,,,,,,,,,,25,52.045,52.045,55.103,1,,,,,,,,,,,,,,,,,,,,,,,,,,,,,,,,,,,,,,,,,,,,,,,,,,,,,,,,,,,,,,,,,,,,,,,,,,,,,,,,,,,,,,,,,,,,,,,,,,,,,,,,,,,,,,,,,,,,,,,,,,,,,,,,,,,,,,,,,,,,,,,,,,,,,,,,,,,,,,,,,,,,,,,,,,,,,,,,,,,,,,,,,,,,,,,,,Nevada [NV],6.93,10.19,11.434,2,,,,,,,,,,6-8%,5.92,7.003,8.813,2,,,,,,,,,,,,,,,,,,,,,,,,,,,,,,,,,,,,,,,,,,,,,,,,,,,,,,,,,,,,,,,,,,,,,,,,,,,,,,,,,,,,,,,,,,,,,,,,,,,,,,,,,,,,,,,,,,,,,,,,,,,,,,,,,,,,,,,,25,11.883,11.883,18.14,1,,,,,,,,,,Samsung,9.015,10.277,13.229,2,,,,,,,,,,,,,,,,,,,,,,,,,,,,,,,,,,,,,,,,,,,,,,,,,,,,,,,,,,,,,,,,,,,,,,,,,,,,,,,,,32,Women,"Corrected-to-normal vision (glasses, contacts, etc)",,IT,Moderately knowledgeable,Some college but no degree,,I am not colorblind,0.703,22.871,23.978,9,,58dd0b15402260000102895b,False,False,False,True,False,False,True,True,False,False,False,True,False,False
2023-09-08 14:10:08,2023-09-08 14:29:58,IP Address,189.230.31.109,100,1190,True,2023-09-08 14:30:04,R_1i58c2WHUP6VpcD,,,,,17.9878,-92.9164,anonymous,EN,I agree,34.629,34.629,35.721,1,176,45.666,53.913,55.556,4,0,0,21.791,0,F_2CfvcTNWP3829VT,signature.png,5165,image/png,"I analyzed the numbers ",20.21,34.724,49.801,5,0,0,1.419,0,,,,,,,,,,,,,,,,,,,,,,,,,,,,,,,,,,,,,,,,,,,,,,,,,,,,,,,,,,,,,,,,,,,,,,,6100,38.893,58.471,61.664,2,F_29bngxlvFayMCan,signature.png,3473,image/png,I counted the numbers on the x lines,1.144,12.341,27.645,5,True,40.794,40.794,41.978,1,F_3R8fWAQsx6NzqUu,signature.png,6242,image/png,I looked at the numbers,16.09,35.655,43.941,7,2012,37.647,39.568,40.47,3,,,,,,,,,,Rising,25.028,47.97,49.332,2,F_vZbPQEkO12DXivv,signature.png,5874,image/png,I just compared the number of girls from 2009 to 2012 and saw the line increasing,1.146,25.187,50.39,6,False,21.238,21.238,22.321,1,F_3O9apUtKkxxHrkC,signature.png,4252,image/png,I found helpful to have the years in order,1.569,28.984,43.74,5,,,,,,,,,,,,,,,,,,,,,,,,,,,,,,,,,,,,,,,,,,,,,,,,,,,,,,,,,,,,,,,,,,,,,,,,,,,,,,,,,,,,,,,,,,,,,,,,,,,,,,,,,,,,,,,,,,,,,,,,,,,,,,,,,,,,,,,,,,,,,,,,,,,,,,,,,,,,,750,200,45.241,53.681,55.057,4,F_30ei5nHViHNOtC0,signature.png,3765,image/png,I looked at the number of stations,1.064,31.588,33.022,5,True,F_sbrnYpoNl9ZXXNv,signature.png,2784,image/png,I compared the size of the circles,1.072,14.296,22.931,3,I'm not sure,54.485,54.485,55.74,1,F_3hin9bTCh2JXuwb,signature.png,4666,image/png,I wasn't quite sure of my answer,1.042,30.976,40.227,5,I'm not sure,21.951,22.772,43.699,2,F_UiEWvoRMerdL2cp,signature.png,6710,image/png,I didn't answer properly,17.454,26.196,35.119,3,Shanghai,51.478,54.583,56.792,4,,,,,,,,,,,,,,,,,,,,,,,,,,,,,,,,,,,,,,,,,,,,,,,,,,,,,,,,,,,,,,,,,,,,,,,,,,,,,,,,,,,,,,,,,,,,,,,,,,,,,,,,,,,,,,,,,,,,,,,,,,,,,,,,,,,,,,,,,,,,,,,,,,,,,,,,,,,,,,,,,,,,,,,,,,,,,,,,,,,,,,,,,,,,,,,,,,,,,,,,,,,,,,,,,,,,,,,,,,,,,,,,,,,,,,,,,,,,,,Google,19.911,48.392,49.849,3,,,,,,,,,,False,9.646,9.646,10.902,1,F_zT4He3L5iuUadsl,signature.png,6026,image/png,I compared the sizes of amazon and yahoo!,0.978,11.96,27.288,4,Retail,36.527,40.767,42.016,4,,,,,,,,,,,,,,,,,,,,,,,,,,,,,,,,,,,,,,,,,,,,,,,,,,,,,,,,,,,,,,,,,,,,,,,,,,,,,,,,99,12,14.884,23.308,24.967,3,,,,,,,,,,6,65.074,65.074,66.693,1,,,,,,,,,,23,Women,Normal vision,,Marketing,Beginner,High school graduate - High school diploma or equivalent (for example: GED),,I am not colorblind,1.233,22.302,23.117,11,I didn't,613a3fa3cd445d55f2e1a486,False,True,True,False,False,False,False,False,True,False,False,False,True,False
2023-09-08 14:11:32,2023-09-08 14:30:04,IP Address,109.78.148.4,100,1112,True,2023-09-08 14:30:08,R_2v2rWlRd58loD8l,,,,,53.3379,-6.2591,anonymous,EN,I agree,9.535,17.776,18.976,4,176,31.352,43.525,47.989,3,15.634,15.634,16.821,1,F_237CH11PFnwMqP9,signature.png,4955,image/png,"No, everything makes sense so far",13.567,31.139,43.65,6,0,0,7.326,0,,,,,,,,,,,,,,,,,,,,,,,,,,,,,,,,,,,,,,,,,,,,,,,,,,,,,,,,,,,,,,,,,,,,,,,6500,19.703,43.912,44.895,4,F_23qhBqAfs6dYk25,signature.png,3769,image/png,If I am reading the chart properly by adding Isla to Amelia's values then my drawing indicates my thought process.,12.214,81.31,114.494,9,True,33.266,47.642,48.541,5,F_WvXJ8fustQGggTf,signature.png,5679,image/png,"I'm not familiar with reading these types of graphs but I assumed that because Isla's value is above Amelia, Isla's numbers also include Amelia's total.",30.773,105.786,118.333,10,2012,33.752,39.801,41.293,4,,,,,,,,,,Rising,15.959,19.233,20.397,3,F_dg5QCRz3CzchI89,signature.png,4667,image/png,The values are on an incline,8.217,19.437,39.458,4,False,7.689,21.05,22.359,3,F_e9cr5jwvPznEWzf,signature.png,3166,image/png,2013 is higher than 2014,14.422,61.061,66.979,8,,,,,,,,,,,,,,,,,,,,,,,,,,,,,,,,,,,,,,,,,,,,,,,,,,,,,,,,,,,,,,,,,,,,,,,,,,,,,,,,,,,,,,,,,,,,,,,,,,,,,,,,,,,,,,,,,,,,,,,,,,,,,,,,,,,,,,,,,,,,,,,,,,,,,,,,,,,,,,,,,,,,,,,,,,,,,,,,,,,,,,,,,,,,,,,,,,,,,,,,,,,,,,,,,,,,,,,,,,,,,,,,,,,,,,,,,,,,,,,,,,,,,,,,,,,,,,,,,,,,,,,,,,,,,,,,,,,,,,,,,,0.72,13.635,34.46,41.03,3,,,,,,,,,,Aug 2019,,8.92,23.066,24.736,4,,,,,,,,,,0.89,0.68,6.522,46.856,50.24,11,,,,,,,,,,Falling,8.661,55.516,56.437,7,,,,,,,,,,,,,,,,,,,,,,,,,,,,,,,,,,,,,,,,,,,,,,,,,,,,,,,,,,,,,,,,,,,,,,,,,,,,,,,,,,,,,,,,,,,,,,,,,,,,,,,,,,,,,,,,,,,,,,,,,,Google,16.983,30.496,31.566,5,,,,,,,,,,False,17.239,23.655,24.974,4,F_3GdYyJfpNFUmzUY,signature.png,7937,image/png,The shape for Yahoo is bigger than Amazon,8.143,36.082,48.671,7,Retail,6.531,10.186,12.408,3,,,,,,,,,,,,,,,,,,,,,,,,,,,,,,,,,,,,,,,,,,,,,,,,,,,,,,,,,,,,,,,,,,,,,,,,,,,,,,,,100,14,7.79,42.991,46.092,5,,,,,,,,,,6,26.461,36.2,38.288,4,,,,,,,,,,37,Women,"Corrected-to-normal vision (glasses, contacts, etc)",,lab animal tech,Beginner,Some college but no degree,,I am not colorblind,1.098,48.717,49.802,13,No issues,60309b6162da62f3898324d4,False,True,False,False,False,False,False,False,True,False,False,False,True,True
2023-09-08 14:17:26,2023-09-08 14:30:12,IP Address,82.34.51.121,100,765,True,2023-09-08 14:30:17,R_2WNi2HH78I5OZOO,,,,,53.8151,-3.0603,anonymous,EN,I agree,3.449,3.449,4.586,1,177,31.213,31.213,34.708,1,0,0,10.296,0,F_33d7LyRRDA44Z0l,signature.png,5385,image/png,Across then down,13.36,29.163,44.167,8,0,0,1.492,0,,,,,,,,,,,,,,,,,,,,,,,,,,,,,,,,,,,,,,,,,,,,,,,,,,,,,,,,,,,,,,,,,,,,,,,6200,5.762,13.366,17.338,2,F_25yVwBNJBfmvvgZ,signature.png,3657,image/png,Across and then down to find it,9.347,11.945,22.471,3,False,20.559,20.559,22.175,1,F_1Oko2yniAgmtbEh,signature.png,4589,image/png,The simpleness of the graph was very helpful,3.764,15.524,36.82,5,2012,11.68,21.644,22.289,4,,,,,,,,,,Rising,17.666,18.837,19.232,2,F_33fLJoB7rSZZWCq,signature.png,4699,image/png,The was helpful and the bold colours were helpful,3.893,33.185,33.453,5,False,20.224,21.359,22.324,2,F_3PNRDaSyBCaiJP9,signature.png,5420,image/png,The key was helpful.,11.199,27.482,36.218,7,44,2.601,17.026,18.452,3,,,,,,,,,,183,10.315,10.315,13.055,1,,,,,,,,,,74,44,20.125,25.345,27.226,2,,,,,,,,,,False,12.729,12.729,13.934,1,F_3suKEwXxyL8yE1V,signature.png,4392,image/png,No one in that area at all,7.177,17.516,24.82,4,I'm not sure,8.379,8.379,14.357,1,F_2q4UrzkRJGAJ7zR,signature.png,3281,image/png,I don't understand the wording.,4.117,7.068,16.926,4,182,10.54,10.54,13.367,1,,,,,,,,,,,,,,,,,,,,,,,,,,,,,,,,,,,,,,,,,,,,,,,,,,,,,,,,,,,,,,,,,,,,,,,,,,,,,,,,,,,,,,,,,,,,,,,,,,,,,,,,,,,,,,,,,,,,,,,,,,,,,,,,,,,,,,,,,,,,,,,,,,,,,,,,,,,,,,,,,,,,,,,,,,,,,,,,,,,,,,,,,,,,,,,,,,,,,,,,,,,,,,,,,,,,,,,,,,,,,,,,,,,,,,,,,,,,,,,,,,,,,,,,,,,,,,,,,,,,,,,,,,,,,,,,,,,,,,,,,,,,,,,,,,,,,,,,,,,,,,,,,,,,,,,,,,,,,,,,,,,,,,,,,,,,,,453,43.169,43.169,44.955,1,F_eQdVvbO5bZBFdrr,signature.png,5541,image/png,The points are hard to read. Should be  in intervals of 10,6.461,22.169,49.615,14,False,11.256,11.256,12.163,1,F_2XcdTzGB23WL7gk,signature.png,3275,image/png,40 to 50 is slightly higher,2.734,4.029,13.846,3,30 - 40 Km,3.928,4.937,5.51,2,,,,,,,,,,,,,,,,,,,,,,,,,,,,,,,,,,,,,,,,,,,,,,,,,,,,,,,,,,,,,,,,,,,,,,,,,,,,,,,,25,13.89,13.89,18.658,1,F_7ahT4b2yU0e2JZT,signature.png,8702,image/png,"The blocks are helpful for estimations ",18.742,31.733,44.414,19,Great Britain,10.188,10.188,11.696,1,,,,,,,,,,Australia,12.1,13.7,14.324,3,F_3nfxdCG6t6uufBu,signature.png,3745,image/png,The clear colours were good,3.281,4.577,15.401,2,,,,,,,,,,,,,,,,,,,,,,,,,,,,,,29,Women,Normal vision,,admin,Moderately knowledgeable,"Bachelor’s degree (For example: BA, AB, BS)",,I am not colorblind,0.895,19.582,20.221,8,thanks,6033f09832d8421272da43ac,False,False,False,False,False,True,False,False,True,False,True,True,False,False
2023-09-08 14:17:15,2023-09-08 14:30:32,IP Address,192.55.109.5,100,796,True,2023-09-08 14:30:38,R_1ILTvcjG8il5ivT,,,,,53.4264,18.2435,anonymous,EN,I agree,4.699,4.699,5.348,1,177,30.91,39.002,64.516,3,0,0,11.43,0,F_3rYsjQ7HGxiemuw,signature.png,5470,image/png,Firstly I thought height would be on the left,12.331,31.792,50.129,4,0,0,1.313,0,50,12.983,14.219,16.405,2,,,,,,,,,,Stockholm,14.073,15.567,17.406,3,,,,,,,,,,False,8.541,8.541,9.247,1,F_2VmPOw3eyhKrMaY,signature.png,5709,image/png,"These bars may be throublesome to compare in most cases, especially the less of difference is between them",6.218,18.865,68.937,4,False,34.016,35.043,35.302,2,F_1o0SjmQQX8Xzf5e,signature.png,7151,image/png,this time water bars were similar and the Toronto one for soda was much bigger so it was relatively easy to compare,5.944,48.802,49.125,9,40,22.982,22.982,24.296,1,F_pxXNgR2R2M7F4OJ,signature.png,5026,image/png,this is probably lowest-biggest price thus i am unable to provide an exact number,3.8,11.767,31.211,6,,,,,,,,,,,,,,,,,,,,,,,,,,,,,,,,,,,,,,,,,,,,,,,,,,,,,,,,,,,,,,,,,,,,,,,,,,,,,,,,,,,,,,,,,,,,,,,,,,,,,,,,,,,,,,,,,,,,,,,,,,,,,,,,,,,,,,,,,,,,,,,,,,,,,,,,,,,,,,,,,,,,,,,,,,,,,,,,,,,,,,,,,,,,,,,,,,,,,,,,,,,,,,,,,,,,,,,,,,,,,,,,,,,460,170,14.08,21.676,25.372,4,,,,,,,,,,True,F_WcdT2ciWZDZqmfD,signature.png,6662,image/png,The circles are easy to compare in size,10.51,15.5,25.609,3,False,15.547,15.547,23.224,1,F_8jkbrgQYLGRueL7,signature.png,5863,image/png,"Dots are not getting bigger in any particular pattern, so i would look at the smallest and the biggest and compare them to the question",11.562,24.947,50.506,5,Impossible to answer with this visualization,10.223,19.525,19.908,2,F_73Z4bwU2ae3jJHb,signature.png,3050,image/png,"This should be sorted in other way, so that one can mathematically find out the answer",8.207,15.741,44.862,2,Shanghai,15.709,17,21.426,3,,,,,,,,,,,,,,,,,,,,,,,,,,,,,,,,,,,,,,,,,,,,,,,,,,,,,,,,,,,,,,,,,,,,,,,,,,,,,,,,,,,,,,,,,,,,,,,,,,,,,,,,,,,,,,,,,,,,,,,,,,,,,,Nevada [NV],8.438,12.819,16.295,2,,,,,,,,,,8-10%,19.662,22.402,24.456,3,F_276TEWd7AhkZprG,signature.png,4715,image/png,"yeah i am blind xD i don't know states of US and did not expect this one state to be written in red so my brain totally ommited that, had to search whole map three times and then missed the color",4.361,46.155,46.507,5,,,,,,,,,,,,,,,,,,,,,,,,,,,,,,,,,,,,,,,,,,,,,,,,,,,,,,,,,,,,,,,,,,,,,,,,,,,,,,,,,,,,,,,,,,,,,,,,,,,,,,,,,,,,,,,,,,,,,,,,,,,,,,,24,7.588,7.588,8.707,1,,,,,,,,,,Samsung,5.551,5.551,7.304,1,,,,,,,,,,,,,,,,,,,,,,,,,,,,,,,,,,,,,,,,,,,,,,,,,,,,,,,,,,,,,,,,,,,,,,,,,,,,,,,,,22,Man,"Corrected-to-normal vision (glasses, contacts, etc)",,linguistics,Beginner,Some college but no degree,,I am not colorblind,0.684,23.505,24.633,10,"No problems, it was one of better made studies, well looking and I really appreciate dark background!",5e569011c0486f03a51801b5,False,False,True,True,False,False,False,True,False,True,False,False,False,False
2023-09-08 14:10:39,2023-09-08 14:30:45,IP Address,169.239.47.219,100,1205,True,2023-09-08 14:30:49,R_24IBNfNMWz4DNnw,,,,,-29.8556,31.0449,anonymous,EN,I agree,11.262,26.779,28.437,4,177,11.905,36.052,39.741,5,15.262,21.623,23.43,2,F_RrICL5q5XPCHJst,signature.png,6072,image/png,"the axis on the graph made it easier for me to find what i was looking for. ",8.18,78.026,79.402,18,0,0,3.296,0,,,,,,,,,,,,,,,,,,,,,,,,,,,,,,,,,,,,,,,,,,,,,,,,,,,,,,,,,,,,,,,,,,,,,,,,,,,,,,,,,,,,,,,,,,,,,,,,,,,,,,,,,,,,,,,,,,,,,,,,,,,,,,,,,,,,,,,,,,,,,,,,,,,,,,,,,,,,,,,,,,,,,,,,,,,,,,,,,,,,,,,,,,,,,,,,,,,,,,,,,,,,,,,,,,,,,,,,,,,,,,,,,,50,7.414,9.137,11.994,2,,,,,,,,,,Apr,5.182,10.339,11.764,4,,,,,,,,,,57,16,18.293,34.598,36.379,6,,,,,,,,,,Falling,18.238,19.413,21.677,2,,,,,,,,,,27,6.701,41.335,43.9,3,,,,,,,,,,451,152,22.489,43.737,45.082,5,,,,,,,,,,True,F_RftNqeoDZiYvQ1H,signature.png,5723,image/png,"drawing on the graph will make you establish the number of stations of Tokyo and Guangzhou, but the size of the circle enabled me to identify the bigger ridership",7.403,66.084,134.012,16,False,13.215,16.808,19.242,4,F_3fUlZ9qdxKdPxZs,signature.png,3817,image/png,"first I determined how many stations Beijing had, it had 750 which was among the highest number of stations, and its ridership was only 2.1 bn per year, which was smaller-according to the key next to the graph",13.175,117.39,118.608,11,I'm not sure,13.16,35.405,36.818,3,F_2rSgxaAlzMmeBWx,signature.png,3345,image/png,"i first had to connect the 200km and 300 stations, after doing so I would be able to determine the average, it really helped me because at first I was not sure of the answer but now I saw that the answer is actually false",4.316,49.775,138.963,14,Shanghai,11.243,25.981,29.084,6,,,,,,,,,,,,,,,,,,,,,,,,,,,,,,,,,,,,,,,,,,,,,,,,,,,,,,,,,,,,,,,,,,,,,,,,,,,,,,,,,,,,,,,,,,,,,,,,,,,,,,,,,,,,,,,,,,,,,,,,,,,,,,,,,,,,,,,,,,,,,,,,,,,,,,,,,,,,,,,,,,,,,,,,,,,,,,,,,,,,,,,,,,,,,,,,,,,,,,,,,,,,,,,,,,,,,,,,,,,,,,,,,,,,,,,,,,,,,,Google,16.5,36.179,38.314,6,,,,,,,,,,False,14.807,19.328,20.746,3,F_3KpzhUlYyNjvxz8,signature.png,6035,image/png,"I first had to draw arrows to truly establish the biggest block between the two, although  feel like I didnt need to do that",5.91,44.029,93.708,16,Retail,19.89,24.88,26.406,4,,,,,,,,,,,,,,,,,,,,,,,,,,,,,,,,,,,,,,,,,,,,,,,,,,,,,,,,,,,,,,,,,,,,,,,,,,,,,,,,99,12,9.484,21.396,22.774,4,,,,,,,,,,6,6.942,18.998,20.35,4,,,,,,,,,,27,Women,Normal vision,,"Environmental Health ",Beginner,"Bachelor’s degree (For example: BA, AB, BS)",,I am not colorblind,1.745,39.84,41.315,11,"I did not encounter any issues, the study went well and was very interesting",6166a03f5063db088c458b73,False,True,True,False,False,False,True,False,False,False,False,False,True,False
2023-09-08 14:17:11,2023-09-08 14:31:29,IP Address,89.64.11.160,100,858,True,2023-09-08 14:31:36,R_339oxKJvqasU1as,,,,,51.1043,17.0335,anonymous,EN,I agree,10.802,14.46,15.562,5,75,10.88,17.267,23.391,5,4.116,4.116,5.94,1,F_2EjmZvQONmXERLC,signature.png,2532,image/png,I picked the highest point matching the weight,10.116,24.343,34.248,8,0,0,1.598,0,,,,,,,,,,,,,,,,,,,,,,,,,,,,,,,,,,,,,,,,,,,,,,,,,,,,,,,,,,,,,,,,,,,,,,,,,,,,,,,,,,,,,,,,,,,,,,,,,,,,,,,,,,,,,,,,,,,,,,,,,,,,,,,,,,,,,,,,,,,,,44,46.58,48.835,50.361,3,,,,,,,,,,1.82,78.972,101.317,105.385,10,F_8xnGrSIja0dwwSt,signature.png,2472,image/png,everything was clear,2.313,8.464,14.689,4,74,44,8.288,20.329,22.736,6,,,,,,,,,,False,106.466,106.837,108.712,2,F_1oFFQvT7ESGULYl,signature.png,3449,image/png,the individuals of that height are not centered around the mentioned weight range,3.321,11.751,33.964,4,False,14.325,15.249,16.459,2,F_25Z2bFTrouZeUBs,signature.png,3188,image/png,im not sure what negative linear relationship is exactly,4.848,7.789,28.096,3,182,4.206,7.117,10.515,3,,,,,,,,,,,,,,,,,,,,,,,,,,,,,,,,,,,,,,,,,,,,,,,,,,,,,,,,,,,,,,,,,,,,,,,,,,,,,,,,,,,,,,,,,,,,,,,,,,,,,,,,,,,,,,,,,,,,,,,,,,,,,,,,,,,,,,,,,,,,,,,,,,,,,,,,,,,,,,,,,,,,,,,,,,,,,,,,,,,,,,,,,,,,,,,,,,,,,,,,,,,,,,0.72,14.389,14.966,19.535,2,,,,,,,,,,Aug 2018,,16.859,18.166,20.958,2,F_qI94ljnrb2IcN9L,signature.png,2500,image/png,the lowest point on the chart,1.757,6.809,16.681,4,0.78,0.76,9.147,19.45,20.63,5,F_xi36VqPbLoT2Aq5,signature.png,2762,image/png,nothing was confusing in this case,5.583,11.076,25.898,5,Rising,20.403,24.248,25.464,5,F_2q4N2KNBPsB03gD,signature.png,3036,image/png,rising figures on the chart indicated the rising trend in prices,4.606,51.242,69.984,6,Nevada [NV],5.432,11.524,12.789,3,,,,,,,,,,6-8%,10.158,11.656,12.86,2,,,,,,,,,,,,,,,,,,,,,,,,,,,,,,,,,,,,,,,,,,,,,,,,,,,,,,,,,,,,,,,,,,,,,,,,,,,,,,,,,,,,,,,,,,,,,,Google,11.16,13.517,14.906,2,,,,,,,,,,False,11.617,11.617,13.129,1,F_BLnEp7pJoIDnTAR,signature.png,3782,image/png,yahoo had more visitors based on the charts,5.332,11.707,26.519,5,Retail,9.09,10.766,12.171,2,,,,,,,,,,,,,,,,,,,,,,,,,,,,,,,,,,,,,,,,,,,,,,,,,,,,,,,,,,,,,,,,,,,,,,,,,,,,,,,,,,,,,,,,,,,,,,,,,,,,,,,,,,,,,32,Women,Normal vision,,languages,Beginner,"Master’s degree (For example: MA, MS, MEng, MEd, MSW, MBA)",,I am not colorblind,11.798,47.595,49.129,35,,5e8bbf2d430dd50008c4fccc,False,False,False,True,False,False,False,False,False,False,False,True,True,True
2023-09-08 14:12:54,2023-09-08 14:32:18,IP Address,186.20.202.231,100,1163,True,2023-09-08 14:32:26,R_1CfNOq4BP1ODnXy,,,,,-33.4521,-70.6536,anonymous,EN,I agree,9.79,9.79,11.084,1,176,17.114,17.114,23.391,1,0,0,12.126,0,F_1mDjpt4LSnpVtOL,signature.png,5084,image/png,"The weight axis was the most helpful. Once I located the highest number, I could just look down and see the height.",7.862,36.131,85.318,8,0,0,1.139,0,,,,,,,,,,,,,,,,,,,,,,,,,,,,,,,,,,,,,,,,,,,,,,,,,,,,,,,,,,,,,,,,,,,,,,,6500,13.56,13.56,17.821,1,F_31WB8XVcwrNeO0H,signature.png,3546,image/png,"Just had to locate where the 'edge' of purple is in the year 2010. Getting an exact number is near to impossible, but I could make an estimate by guessing where 7000 is between 6000 and 8000 are..",5.444,159.466,159.718,25,True,12.191,12.697,14.87,2,F_PMtpJXr06wj0UF3,signature.png,6719,image/png,"The colors made the graph easy to understand, you just had to see which one was bigger.",6.289,48.149,69.03,8,2012,7.162,8.134,8.951,2,,,,,,,,,,Rising,15.376,15.376,16.206,1,F_1Lth1XK5CQaG6rb,signature.png,6785,image/png,You can clearly see in the graph how the use of the name goes up between those years.,5.723,74.784,91.242,9,False,7.551,7.551,11.939,1,F_1gRDbO4Jdx5qrUn,signature.png,4870,image/png,You can clearly see how the number goes down in the graph between both years.,4.883,14.584,33.296,5,,,,,,,,,,,,,,,,,,,,,,,,,,,,,,,,,,,,,,,,,,,,,,,,,,,,,,,,,,,,,,,,,,,,,,,,,,,,,,,,,,,,,,,,,,,,,,,,,,,,,,,,,,,,,,,,,,,,,,,,,,,,,,,,,,,,,,,,,,,,,,,,,,,,,,,,,,,,,500,150,6.993,10.432,19.599,2,F_DoD3mPz6p2oQQEx,signature.png,5678,image/png,The name of the axis indicated the answer.,3.503,32.763,38.987,8,True,F_3RaT4mD1aMkoy0i,signature.png,6028,image/png,"The image was confusing at first because it shows a lot of information unrelated to the question, but after analyzing the size of the circles it was easy.",8.068,46.937,69.226,6,False,4.405,4.405,10.703,1,F_XTAJgX0RaIVxvsR,signature.png,7027,image/png,Cities close together in number of stations but with great differences in ridership indicate that the affirmation is not true.,6.696,67.461,101.445,14,False,16.528,16.528,17.798,1,F_2t5aI3UikonP8wg,signature.png,5944,image/png,"Just by locating where 300 stations and 200km are in the chart, you can see none of them are close to that range.",6.838,52.368,84.336,9,Shanghai,9.21,13.438,17.665,3,,,,,,,,,,,,,,,,,,,,,,,,,,,,,,,,,,,,,,,,,,,,,,,,,,,,,,,,,,,,,,,,,,,,,,,,,,,,,,,,,,,,,,,,,,,,,,,,,,,,,,,,,,,,,,,,,,,,,,,,,,,,,,Nevada [NV],7.876,12.369,13.653,2,,,,,,,,,,6-8%,7.429,15.701,21.644,5,,,,,,,,,,,,,,,,,,,,,,,,,,,,,,,,,,,,,,,,,,,,,,,,,,,,,,,,,,,,,,,,,,,,,,,,,,,,,,,,,,,,,,,,,,,,,,,,,,,,,,,,,,,,,,,,,,,,,,,,,,,,,,,,,,,,,,,,,,,,,,,,,,,,,,,,,,,,,,,,,,,,,,,,,,,,,,,,,,,,,,,,,,,,,,,,,,,,,,,,,,,,,,10,100,4.299,9.716,13.131,3,F_2zeChTxNvxx4DON,signature.png,4738,image/png,"I just noticed I got this wrong, should have said 0 to 100, I was confused because the first number you can see is 10.",3.555,47.484,68.358,21,6,16.927,16.927,18.68,1,,,,,,,,,,24,Women,"Corrected-to-normal vision (glasses, contacts, etc)",,Fashion Design,No familiarity,Some college but no degree,,I am not colorblind,0.698,33.338,34.399,9,,616f94cd9cd003d37c9db38c,False,True,True,True,False,False,False,False,True,False,False,False,False,False
